reference;libelle;marque
FY-33LSh6;fermentum arcu. Vestibulum ante ipsum primis in faucibus orci;Primis Corporation
mc+32_K6;Vivamus sit amet;Nec Ante Associates
BX-30EQq6;Fusce aliquet magna a neque.;Primis Corporation
UC-71QEn5;in lobortis tellus justo sit amet nulla. Donec non;Primis Corporation
BG-66ICi4;molestie orci;Primis Corporation
JI-41BRg9;Curabitur ut odio vel est;Primis Corporation
uD8GB15;convallis convallis dolor. Quisque tincidunt pede ac urna. Ut;Pellentesque Foundation
MH-29FMq3;Etiam gravida molestie arcu. Sed eu nibh;Primis Corporation
NF-95MPk7;libero mauris, aliquam;Primis Corporation
WK-01PNc7;sit amet, consectetuer adipiscing elit. Aliquam auctor, velit eget laoreet;Primis Corporation
o2II5-N;neque.;Sagittis Duis
TN-31KTm2;ac turpis egestas. Aliquam fringilla cursus purus.;Primis Corporation
o2EI7-R;et malesuada fames ac turpis egestas. Aliquam;Sagittis Duis
vh+27_H3;amet, consectetuer adipiscing elit. Etiam laoreet, libero;Nec Ante Associates
KJ-31MNp8;pharetra ut,;Primis Corporation
i7AU5-D;lectus, a sollicitudin orci sem eget massa. Suspendisse eleifend.;Sagittis Duis
NF-36YRp8;pede ac urna. Ut;Primis Corporation
u3OE1-W;accumsan sed, facilisis vitae, orci. Phasellus dapibus quam;Sagittis Duis
xl+48_S1;cursus non, egestas a, dui. Cras pellentesque. Sed dictum.;Nec Ante Associates
FI-89EXb2;interdum. Curabitur dictum.;Primis Corporation
i5EU3-D;non, luctus sit;Sagittis Duis
af+77_T1;eleifend vitae, erat. Vivamus;Nec Ante Associates
rm+46_M1;turpis egestas. Fusce aliquet magna a neque. Nullam ut;Nec Ante Associates
e5EO7-U;eu arcu. Morbi sit amet massa. Quisque porttitor eros nec;Sagittis Duis
