reference;libelle;marque
op+80_U5;velit eu sem.;Nec Ante Associates
i9OE0-Y;tempus scelerisque, lorem ipsum sodales purus, in molestie tortor nibh;Sagittis Duis
rv+24_L8;Suspendisse sed dolor.;Nec Ante Associates
sc+25_K9;a tortor. Nunc;Nec Ante Associates
o4II3-B;libero et tristique pellentesque, tellus sem mollis dui,;Sagittis Duis
YV-47FLd4;ornare, elit elit fermentum risus,;Primis Corporation
uR3BP22;rhoncus. Donec est.;Pellentesque Foundation
eQ6UR66;est. Nunc laoreet lectus quis massa. Mauris vestibulum,;Pellentesque Foundation
ki+67_D3;eleifend non, dapibus rutrum,;Nec Ante Associates
GU-20BYu7;libero nec ligula consectetuer rhoncus. Nullam;Primis Corporation
ng+12_T2;laoreet ipsum. Curabitur consequat, lectus;Nec Ante Associates
a5UA7-B;nec tempus mauris;Sagittis Duis
e3OU2-K;euismod urna. Nullam lobortis quam a felis ullamcorper viverra.;Sagittis Duis
YB-58IVs4;ut lacus. Nulla;Primis Corporation
FT-34LPj5;vehicula et, rutrum eu, ultrices sit amet,;Primis Corporation
wl+48_F6;id, libero. Donec;Nec Ante Associates
uO5GN89;Integer id magna et;Pellentesque Foundation
i7UO2-F;amet, faucibus ut,;Sagittis Duis
a2IO5-W;lectus rutrum urna, nec luctus felis;Sagittis Duis
ro+32_F5;egestas blandit. Nam;Nec Ante Associates
RX-28UOi2;non, cursus non, egestas a, dui. Cras pellentesque. Sed;Primis Corporation
cw+78_D7;ut quam vel sapien imperdiet ornare.;Nec Ante Associates
YL-28MLl4;ullamcorper.;Primis Corporation
iZ3XV44;sollicitudin;Pellentesque Foundation
VN-18HFh4;rhoncus. Donec est. Nunc ullamcorper, velit in;Primis Corporation
FK-42TYd5;volutpat. Nulla dignissim. Maecenas;Primis Corporation
XY-74RPj6;at arcu. Vestibulum ante ipsum primis;Primis Corporation
HJ-76REh2;nunc interdum feugiat. Sed;Primis Corporation
tb+12_P7;iaculis quis, pede. Praesent;Nec Ante Associates
i9IA4-N;Nam consequat dolor vitae dolor. Donec;Sagittis Duis
oC9EV83;in faucibus;Pellentesque Foundation
si+96_J6;blandit mattis. Cras;Nec Ante Associates
uV6RS31;Quisque porttitor eros nec tellus. Nunc lectus pede,;Pellentesque Foundation
bs+01_G7;porta elit, a feugiat;Nec Ante Associates
a2IE7-M;In condimentum. Donec at;Sagittis Duis
aU7QQ63;erat vel pede blandit congue. In scelerisque scelerisque dui. Suspendisse;Pellentesque Foundation
oO8EF28;enim. Suspendisse aliquet, sem ut cursus luctus,;Pellentesque Foundation
oQ4OV42;sem semper erat, in consectetuer ipsum;Pellentesque Foundation
oS2BX67;tellus justo sit amet nulla. Donec non justo. Proin;Pellentesque Foundation
LW-63LNl7;amet lorem semper auctor. Mauris vel turpis.;Primis Corporation
su+22_Z9;malesuada ut, sem.;Nec Ante Associates
mh+30_E5;non, hendrerit id, ante. Nunc;Nec Ante Associates
ye+14_R7;Nullam feugiat placerat velit. Quisque varius. Nam;Nec Ante Associates
u2EU5-G;Quisque purus sapien, gravida non, sollicitudin;Sagittis Duis
bi+74_T5;elementum at, egestas a, scelerisque sed,;Nec Ante Associates
zu+45_C4;rutrum, justo. Praesent luctus. Curabitur egestas nunc;Nec Ante Associates
aC0CG84;Sed molestie. Sed;Pellentesque Foundation
qz+63_U2;quis, pede. Praesent eu dui. Cum sociis natoque penatibus et;Nec Ante Associates
eO1KV59;tellus faucibus leo, in lobortis;Pellentesque Foundation
DH-42RFd8;justo. Proin non massa non ante;Primis Corporation
QK-64ZTx8;Nullam enim. Sed nulla ante, iaculis nec, eleifend;Primis Corporation
i8UO1-T;imperdiet ornare. In faucibus. Morbi vehicula.;Sagittis Duis
YH-23QCg4;laoreet;Primis Corporation
SP-97AMk8;at, velit. Pellentesque ultricies dignissim lacus.;Primis Corporation
ue+33_P2;turpis non enim. Mauris quis;Nec Ante Associates
VQ-88SWn2;pede sagittis;Primis Corporation
hk+13_T8;Cras dictum ultricies ligula. Nullam;Nec Ante Associates
dg+47_Y2;ad litora torquent per conubia nostra, per;Nec Ante Associates
ES-61EKg2;dictum mi, ac mattis velit justo nec;Primis Corporation
DJ-99BTz2;faucibus id, libero. Donec consectetuer mauris id;Primis Corporation
MX-75VXq3;vitae, posuere at, velit. Cras lorem;Primis Corporation
e7AA4-V;Nulla aliquet. Proin velit. Sed malesuada augue ut;Sagittis Duis
i5OO5-Z;Morbi vehicula. Pellentesque tincidunt tempus risus. Donec egestas. Duis;Sagittis Duis
iN6PQ66;pretium neque. Morbi quis urna.;Pellentesque Foundation
IP-97CPy2;Praesent eu nulla at sem molestie sodales.;Primis Corporation
uL1DB95;turpis nec mauris blandit;Pellentesque Foundation
fc+37_F6;sem ut;Nec Ante Associates
de+13_K3;vitae erat vel pede blandit congue. In;Nec Ante Associates
i3EE1-J;sem mollis dui, in sodales elit erat;Sagittis Duis
o1OE0-O;est ac mattis semper, dui lectus rutrum urna, nec;Sagittis Duis
aC7UY56;ac libero nec ligula consectetuer rhoncus. Nullam velit dui,;Pellentesque Foundation
io+70_Q7;eu sem. Pellentesque ut ipsum ac mi eleifend egestas. Sed;Nec Ante Associates
UX-73WGn5;at pede.;Primis Corporation
ar+46_G2;mi felis, adipiscing fringilla, porttitor;Nec Ante Associates
wt+93_E9;metus urna convallis erat,;Nec Ante Associates
eU7MA55;ipsum. Donec sollicitudin;Pellentesque Foundation
DU-86THp6;dui lectus rutrum urna,;Primis Corporation
XR-21MEe8;Integer in;Primis Corporation
vo+22_F1;at risus. Nunc;Nec Ante Associates
aF7MD31;pede ac urna. Ut tincidunt vehicula;Pellentesque Foundation
oD6KG87;porttitor;Pellentesque Foundation
DW-01OTe4;interdum. Nunc sollicitudin commodo ipsum. Suspendisse non leo.;Primis Corporation
ud+07_R6;senectus et netus;Nec Ante Associates
UI-74LXl8;dolor sit amet, consectetuer adipiscing elit. Etiam laoreet,;Primis Corporation
xy+83_X2;Donec dignissim magna a tortor. Nunc commodo;Nec Ante Associates
iS5XH52;a sollicitudin orci;Pellentesque Foundation
WB-10MSb2;posuere at, velit. Cras lorem lorem, luctus ut, pellentesque;Primis Corporation
iG3BD38;mi eleifend egestas. Sed pharetra,;Pellentesque Foundation
OE-70SYi4;in consequat enim diam vel arcu.;Primis Corporation
VR-76ZPp7;tellus non magna.;Primis Corporation
oM2JJ88;torquent per;Pellentesque Foundation
wt+81_S9;eleifend non, dapibus rutrum, justo. Praesent luctus. Curabitur;Nec Ante Associates
iV7FC33;taciti sociosqu ad litora torquent per conubia;Pellentesque Foundation
UB-43NJd6;Aenean egestas;Primis Corporation
mb+56_N4;ante. Maecenas mi felis, adipiscing fringilla, porttitor;Nec Ante Associates
XM-80MAr9;iaculis, lacus;Primis Corporation
i7OA2-B;Vestibulum ut;Sagittis Duis
VU-64IWh3;leo. Morbi neque tellus,;Primis Corporation
i3IO6-D;ipsum dolor;Sagittis Duis
LL-68DJk6;tempor bibendum. Donec felis orci, adipiscing non, luctus sit;Primis Corporation
e2UI6-W;quam. Pellentesque habitant morbi;Sagittis Duis
a9EE7-X;sollicitudin a, malesuada id, erat. Etiam vestibulum;Sagittis Duis
hc+13_M9;Vivamus non lorem vitae odio sagittis;Nec Ante Associates
DY-69NSp5;elit. Nulla facilisi. Sed;Primis Corporation
IM-02HPc6;et netus et malesuada fames ac turpis;Primis Corporation
a5UO7-D;ornare lectus justo;Sagittis Duis
iR2IO71;ullamcorper. Duis cursus, diam;Pellentesque Foundation
o4AE4-S;ligula. Nullam feugiat;Sagittis Duis
aI1UR73;suscipit nonummy. Fusce fermentum fermentum;Pellentesque Foundation
a9OO7-B;ac mattis velit;Sagittis Duis
VY-35TFe8;ultrices posuere cubilia Curae Phasellus;Primis Corporation
QD-28DIe8;elit. Nulla facilisi. Sed;Primis Corporation
PL-81NJj8;nunc sed pede.;Primis Corporation
hb+66_P5;commodo auctor velit. Aliquam;Nec Ante Associates
up+78_E4;amet risus.;Nec Ante Associates
nw+64_Q6;auctor ullamcorper, nisl arcu;Nec Ante Associates
eW1OR47;odio a purus. Duis elementum,;Pellentesque Foundation
BP-96PRw9;luctus et;Primis Corporation
yk+24_S2;egestas nunc;Nec Ante Associates
xc+58_K8;Integer id magna et ipsum cursus vestibulum. Mauris magna.;Nec Ante Associates
NC-28CKl9;neque. Sed eget lacus.;Primis Corporation
i5AE5-F;Sed pharetra,;Sagittis Duis
ha+63_X5;pharetra sed, hendrerit a, arcu.;Nec Ante Associates
CA-75KIr3;laoreet ipsum. Curabitur consequat, lectus sit amet;Primis Corporation
oB7PB36;vitae velit egestas lacinia. Sed congue, elit sed;Pellentesque Foundation
uX4SE84;Donec fringilla. Donec feugiat metus sit amet ante. Vivamus;Pellentesque Foundation
tt+14_M6;magna, malesuada vel, convallis in, cursus et, eros. Proin ultrices.;Nec Ante Associates
iB5ZI82;urna justo faucibus lectus, a sollicitudin orci sem eget;Pellentesque Foundation
u2EI1-E;in consequat enim diam vel;Sagittis Duis
i2AU9-O;blandit at, nisi. Cum sociis;Sagittis Duis
i9AI5-I;imperdiet dictum magna. Ut tincidunt orci quis lectus. Nullam;Sagittis Duis
eq+27_G6;sagittis. Duis gravida. Praesent eu nulla at;Nec Ante Associates
CH-63MTs2;quam quis diam. Pellentesque habitant morbi;Primis Corporation
my+54_S7;ac;Nec Ante Associates
kq+27_V5;Aliquam erat volutpat. Nulla;Nec Ante Associates
eT2EB26;turpis non;Pellentesque Foundation
o7AI8-X;laoreet, libero et tristique pellentesque,;Sagittis Duis
OP-38RUm8;sem semper erat, in consectetuer ipsum nunc id enim.;Primis Corporation
a2IO9-B;urna. Vivamus molestie dapibus ligula. Aliquam erat volutpat.;Sagittis Duis
ov+64_U3;amet diam eu dolor egestas rhoncus. Proin;Nec Ante Associates
uI2AC49;neque. In ornare sagittis felis. Donec tempor, est ac mattis;Pellentesque Foundation
TJ-63FAy6;semper pretium neque.;Primis Corporation
bg+53_W2;ipsum non arcu. Vivamus sit amet risus.;Nec Ante Associates
qd+95_M9;tellus. Aenean egestas hendrerit neque. In ornare sagittis felis. Donec;Nec Ante Associates
HP-11PPf8;fames ac turpis egestas. Fusce aliquet;Primis Corporation
iO2IK47;sem ut cursus;Pellentesque Foundation
vn+11_S9;Morbi sit amet massa. Quisque porttitor;Nec Ante Associates
aB7EY23;vitae sodales nisi;Pellentesque Foundation
iL8XB29;urna;Pellentesque Foundation
i6EO3-E;metus eu erat semper;Sagittis Duis
u4AO9-S;magna, malesuada vel, convallis in, cursus et,;Sagittis Duis
jx+08_Z4;nec ligula consectetuer;Nec Ante Associates
gw+07_V9;metus;Nec Ante Associates
u0EE8-A;lorem tristique aliquet. Phasellus fermentum convallis ligula.;Sagittis Duis
QM-16VKm2;luctus felis purus ac tellus. Suspendisse sed;Primis Corporation
dq+83_S4;quis lectus. Nullam suscipit, est ac facilisis facilisis, magna tellus;Nec Ante Associates
TZ-80OKw1;scelerisque neque sed sem egestas;Primis Corporation
VF-44ZHq4;Curabitur dictum. Phasellus in felis.;Primis Corporation
u8OO3-M;arcu. Vivamus sit amet risus.;Sagittis Duis
eF0CE93;Donec dignissim;Pellentesque Foundation
LG-63EOw5;Suspendisse ac;Primis Corporation
aB5DH32;et, euismod et, commodo at, libero.;Pellentesque Foundation
oM5TO37;nec ligula consectetuer rhoncus. Nullam;Pellentesque Foundation
u5EO7-D;cursus luctus, ipsum leo elementum sem,;Sagittis Duis
GT-52OLl5;erat. Sed nunc est, mollis non, cursus non,;Primis Corporation
XE-81FDn2;a, magna. Lorem ipsum dolor sit amet, consectetuer adipiscing;Primis Corporation
DB-36QBv8;non massa non ante bibendum ullamcorper. Duis cursus, diam;Primis Corporation
DR-28XKa8;Curabitur sed tortor. Integer;Primis Corporation
i1EO7-T;libero. Morbi accumsan;Sagittis Duis
DP-04ZCp7;tempus non, lacinia at, iaculis quis,;Primis Corporation
a9EI4-F;Curabitur vel lectus. Cum;Sagittis Duis
oL5KG37;at, iaculis quis, pede. Praesent eu dui. Cum sociis;Pellentesque Foundation
im+83_T5;pede. Cum sociis natoque penatibus et;Nec Ante Associates
db+85_G6;felis purus;Nec Ante Associates
UJ-96ATd6;tempus, lorem fringilla;Primis Corporation
ta+54_B8;urna. Nunc;Nec Ante Associates
lh+87_F1;a purus. Duis elementum, dui quis accumsan convallis,;Nec Ante Associates
e9IO2-V;euismod est arcu ac orci.;Sagittis Duis
oD5AS56;rutrum urna, nec luctus felis purus ac tellus.;Pellentesque Foundation
iT5XO73;congue. In scelerisque scelerisque dui. Suspendisse ac;Pellentesque Foundation
gi+54_G3;neque. Nullam ut nisi a odio;Nec Ante Associates
DZ-62QSw5;eget magna. Suspendisse;Primis Corporation
iQ1OQ53;sem molestie sodales. Mauris;Pellentesque Foundation
i9II9-X;Suspendisse ac metus vitae velit egestas lacinia.;Sagittis Duis
LW-44ORy7;egestas. Duis ac arcu.;Primis Corporation
GS-33RWt3;Sed malesuada augue ut lacus. Nulla tincidunt, neque vitae;Primis Corporation
e4IO4-H;velit in aliquet lobortis,;Sagittis Duis
oy+38_G4;metus eu erat semper rutrum. Fusce dolor quam, elementum;Nec Ante Associates
WM-37JRa3;sit amet diam eu dolor;Primis Corporation
eH8PK85;sollicitudin orci;Pellentesque Foundation
o4EE4-Y;Class aptent taciti sociosqu ad;Sagittis Duis
e7IE9-H;dapibus id, blandit at,;Sagittis Duis
zz+85_U6;non nisi. Aenean eget metus. In nec orci.;Nec Ante Associates
oL3OB78;Etiam ligula tortor, dictum eu, placerat eget, venenatis a,;Pellentesque Foundation
o7EA7-B;netus et malesuada fames ac turpis egestas.;Sagittis Duis
PO-43HOf8;ac mattis velit justo nec ante. Maecenas mi felis,;Primis Corporation
QU-29DCq6;mauris.;Primis Corporation
o4EO2-W;commodo at, libero. Morbi accumsan laoreet ipsum.;Sagittis Duis
i5OI1-X;Mauris magna. Duis dignissim;Sagittis Duis
xc+72_B6;ut cursus luctus, ipsum leo elementum sem, vitae;Nec Ante Associates
oQ5PA77;semper pretium neque. Morbi quis urna. Nunc quis arcu;Pellentesque Foundation
o5IO8-R;sed tortor. Integer aliquam adipiscing lacus. Ut;Sagittis Duis
vs+59_D4;consectetuer euismod est arcu ac orci. Ut;Nec Ante Associates
oP6MM95;at sem molestie sodales. Mauris blandit enim consequat;Pellentesque Foundation
RL-67DCx4;lobortis tellus;Primis Corporation
oX8GF82;Integer id magna et ipsum;Pellentesque Foundation
mb+23_D8;dolor;Nec Ante Associates
tt+61_A3;Proin non massa non ante bibendum ullamcorper. Duis;Nec Ante Associates
oZ4CN35;Proin nisl sem, consequat;Pellentesque Foundation
im+55_M7;vel arcu. Curabitur ut odio vel est tempor bibendum.;Nec Ante Associates
uI3MS23;vitae odio sagittis semper. Nam tempor diam;Pellentesque Foundation
IB-42CMn5;vel sapien imperdiet ornare. In faucibus. Morbi vehicula.;Primis Corporation
uM4MA45;risus, at fringilla purus mauris a nunc. In;Pellentesque Foundation
VB-32LEy1;a felis ullamcorper viverra. Maecenas iaculis aliquet diam. Sed;Primis Corporation
uD8YY84;Ut sagittis lobortis mauris. Suspendisse aliquet molestie;Pellentesque Foundation
TV-21CCk5;pharetra ut, pharetra sed,;Primis Corporation
QP-33VFb2;nibh vulputate mauris sagittis placerat. Cras dictum;Primis Corporation
aI5JT87;Nunc mauris sapien, cursus in, hendrerit consectetuer, cursus;Pellentesque Foundation
uZ2IY38;ante lectus convallis est, vitae;Pellentesque Foundation
eC9LW43;enim;Pellentesque Foundation
ws+76_I5;Donec egestas. Duis ac arcu. Nunc mauris. Morbi non;Nec Ante Associates
eF1VE28;imperdiet ornare. In faucibus. Morbi;Pellentesque Foundation
oA2OD46;quis accumsan convallis, ante lectus convallis est,;Pellentesque Foundation
oH3DI25;arcu. Sed et libero. Proin mi. Aliquam;Pellentesque Foundation
e7UO2-T;fringilla. Donec feugiat metus sit amet ante. Vivamus non;Sagittis Duis
oD6KI23;dictum. Proin eget odio. Aliquam vulputate ullamcorper;Pellentesque Foundation
YB-25YCd7;cursus;Primis Corporation
WA-29JGr1;libero lacus, varius et, euismod et, commodo at, libero. Morbi;Primis Corporation
jk+88_V2;libero et tristique pellentesque,;Nec Ante Associates
i4OA1-P;dolor sit amet, consectetuer adipiscing;Sagittis Duis
xi+24_F5;dignissim pharetra. Nam ac nulla. In;Nec Ante Associates
bu+64_Q6;lectus convallis est, vitae sodales nisi magna sed;Nec Ante Associates
KK-83GQd7;et magnis;Primis Corporation
e6EO5-U;tincidunt congue turpis. In condimentum. Donec at arcu.;Sagittis Duis
GK-42QRn6;amet, consectetuer;Primis Corporation
uW6EO19;sollicitudin adipiscing ligula. Aenean gravida nunc sed pede.;Pellentesque Foundation
qr+24_P7;et, lacinia vitae, sodales;Nec Ante Associates
EO-14MKm2;nulla ante, iaculis nec,;Primis Corporation
OZ-47JGa9;lobortis tellus justo sit amet;Primis Corporation
o5OA3-K;Nunc lectus pede, ultrices;Sagittis Duis
o9IU6-J;Donec vitae erat vel;Sagittis Duis
em+00_M5;ad litora torquent per conubia nostra, per inceptos;Nec Ante Associates
PP-24DLq4;laoreet, libero et;Primis Corporation
oP4DQ62;Nullam enim. Sed nulla ante, iaculis nec, eleifend non,;Pellentesque Foundation
o1EE7-X;lorem, vehicula et, rutrum eu, ultrices sit amet, risus.;Sagittis Duis
a6II1-M;dolor. Donec fringilla. Donec feugiat metus sit amet ante.;Sagittis Duis
o9UA7-V;quis urna. Nunc quis arcu vel quam;Sagittis Duis
lp+17_L3;aliquam eu, accumsan sed, facilisis;Nec Ante Associates
u0II2-V;Donec tincidunt.;Sagittis Duis
PL-02IEu7;Morbi vehicula. Pellentesque tincidunt tempus risus. Donec egestas. Duis;Primis Corporation
o6IE9-S;vitae diam. Proin;Sagittis Duis
HY-58PWg1;egestas. Aliquam fringilla;Primis Corporation
hi+88_D4;lorem, luctus ut,;Nec Ante Associates
uB0IN83;luctus lobortis. Class;Pellentesque Foundation
aB1TV43;sagittis. Nullam vitae diam.;Pellentesque Foundation
eX8VH77;lacinia mattis. Integer eu lacus.;Pellentesque Foundation
BJ-28DXj4;amet diam eu dolor egestas;Primis Corporation
ST-28YFt9;ornare, libero at;Primis Corporation
FE-96FLb3;erat, eget tincidunt dui augue eu tellus. Phasellus;Primis Corporation
FL-88ZYt7;nec tempus;Primis Corporation
uH4RV75;auctor quis, tristique ac, eleifend vitae, erat.;Pellentesque Foundation
cr+15_W8;Donec dignissim magna a tortor. Nunc commodo;Nec Ante Associates
wt+69_J5;urna. Ut tincidunt vehicula risus. Nulla;Nec Ante Associates
eL4YE39;tempus;Pellentesque Foundation
FI-99OZp4;nec luctus felis purus;Primis Corporation
i5UU5-E;taciti sociosqu ad litora torquent per conubia nostra, per inceptos;Sagittis Duis
JC-11YIr5;Pellentesque habitant morbi;Primis Corporation
e6OI7-G;posuere at,;Sagittis Duis
CP-76DNv7;Aenean egestas hendrerit neque. In ornare sagittis;Primis Corporation
HH-17YEk7;convallis erat,;Primis Corporation
we+34_Y3;dolor, tempus non,;Nec Ante Associates
iY2NY71;augue id ante;Pellentesque Foundation
eY7LG88;sapien,;Pellentesque Foundation
oC4NK65;dui, in;Pellentesque Foundation
OC-18ZZt3;mauris id sapien. Cras dolor dolor, tempus non, lacinia at,;Primis Corporation
dn+71_R8;lorem tristique aliquet. Phasellus fermentum convallis ligula. Donec luctus aliquet;Nec Ante Associates
e5IO5-I;elit, dictum eu,;Sagittis Duis
IT-82BUq1;Ut sagittis lobortis mauris. Suspendisse aliquet;Primis Corporation
oU7IS68;malesuada fringilla est. Mauris eu turpis.;Pellentesque Foundation
e0UE3-X;felis orci,;Sagittis Duis
jj+03_D7;dui, semper et,;Nec Ante Associates
XQ-77QWg6;velit. Aliquam nisl.;Primis Corporation
o4OE6-P;mauris. Integer sem;Sagittis Duis
KD-53QTp8;Proin;Primis Corporation
sw+98_L3;amet massa. Quisque porttitor eros nec tellus.;Nec Ante Associates
YK-44LIb7;non,;Primis Corporation
e6AO8-F;ornare tortor at;Sagittis Duis
LX-52HRu3;pede. Cras vulputate velit eu sem. Pellentesque;Primis Corporation
XL-64MTn5;nec tempus;Primis Corporation
eQ7HO78;Aliquam erat volutpat. Nulla dignissim. Maecenas ornare egestas;Pellentesque Foundation
uL4PY87;sem mollis dui, in;Pellentesque Foundation
PG-29ODq8;cursus. Integer;Primis Corporation
nb+97_S5;et, eros. Proin ultrices. Duis volutpat nunc sit;Nec Ante Associates
bs+57_L2;luctus. Curabitur;Nec Ante Associates
HV-87YQe5;ridiculus mus. Proin vel;Primis Corporation
fb+95_S3;tincidunt aliquam arcu. Aliquam;Nec Ante Associates
bv+48_E3;est ac facilisis facilisis, magna tellus faucibus leo, in;Nec Ante Associates
DD-46NUn4;mauris eu elit.;Primis Corporation
CJ-18UIi5;lobortis quis, pede. Suspendisse dui. Fusce diam;Primis Corporation
oX5FD48;pellentesque. Sed dictum. Proin;Pellentesque Foundation
LF-64SIb2;nibh. Quisque nonummy ipsum non arcu. Vivamus;Primis Corporation
VM-88USl2;Vivamus nibh dolor, nonummy ac, feugiat non, lobortis;Primis Corporation
UC-12FJq4;euismod urna. Nullam lobortis quam a felis ullamcorper;Primis Corporation
oS6HE65;nec ante. Maecenas mi felis,;Pellentesque Foundation
IZ-66ENk5;sed tortor. Integer aliquam adipiscing;Primis Corporation
YH-13IFk3;faucibus. Morbi;Primis Corporation
WK-94FQh2;adipiscing elit. Aliquam auctor,;Primis Corporation
u3AU5-S;lorem lorem, luctus ut, pellentesque eget,;Sagittis Duis
VJ-36CDo2;sed dictum eleifend, nunc risus varius orci, in consequat;Primis Corporation
qa+43_F2;dui quis accumsan convallis, ante lectus convallis est,;Nec Ante Associates
eV6XR56;Suspendisse ac metus vitae velit egestas lacinia.;Pellentesque Foundation
DN-71MYb1;arcu. Morbi sit amet massa. Quisque porttitor eros;Primis Corporation
RJ-31JWq9;quis, pede. Suspendisse dui. Fusce diam nunc, ullamcorper eu,;Primis Corporation
iS8AW42;a felis ullamcorper viverra. Maecenas iaculis aliquet;Pellentesque Foundation
AR-86LXy4;sed,;Primis Corporation
lg+68_U3;lorem, eget mollis lectus pede et risus. Quisque;Nec Ante Associates
eT5XQ71;risus. Donec egestas. Duis ac;Pellentesque Foundation
o7AE1-I;tincidunt pede ac urna. Ut tincidunt vehicula;Sagittis Duis
ZM-51JCz2;egestas blandit. Nam nulla magna, malesuada;Primis Corporation
e9OI1-P;hendrerit. Donec porttitor tellus non;Sagittis Duis
uU3MJ79;dui quis accumsan convallis, ante lectus convallis est,;Pellentesque Foundation
fm+51_P6;non dui nec urna suscipit nonummy.;Nec Ante Associates
PG-20BMu5;convallis est, vitae sodales;Primis Corporation
SB-65YDh4;posuere at, velit. Cras;Primis Corporation
oV6HW43;Donec porttitor tellus non magna. Nam;Pellentesque Foundation
NI-62CQe4;vulputate velit eu sem. Pellentesque;Primis Corporation
XK-32KTe5;dapibus ligula. Aliquam erat volutpat. Nulla dignissim. Maecenas ornare;Primis Corporation
bp+02_Q4;pharetra, felis eget varius ultrices, mauris ipsum;Nec Ante Associates
sn+61_A8;id, blandit at, nisi. Cum sociis natoque penatibus et magnis;Nec Ante Associates
uh+39_C9;Nullam enim. Sed nulla ante, iaculis nec, eleifend non,;Nec Ante Associates
WM-38KVa7;interdum. Sed auctor odio a;Primis Corporation
UN-43QMr2;lacinia vitae, sodales at, velit. Pellentesque ultricies dignissim lacus.;Primis Corporation
qx+11_Y2;mollis nec, cursus a, enim. Suspendisse aliquet, sem;Nec Ante Associates
i6UI3-Y;arcu. Curabitur ut odio vel est tempor bibendum. Donec felis;Sagittis Duis
kb+77_T7;Donec tempus,;Nec Ante Associates
eF1TM31;ad litora torquent per conubia;Pellentesque Foundation
cs+42_V2;diam. Sed diam lorem, auctor quis, tristique ac, eleifend;Nec Ante Associates
IY-81EEy5;consequat enim diam vel arcu. Curabitur;Primis Corporation
EC-76WNw3;et malesuada fames ac turpis egestas. Fusce;Primis Corporation
IL-27CGi4;eu dolor egestas rhoncus. Proin;Primis Corporation
u9AI3-G;magna nec quam. Curabitur;Sagittis Duis
AN-83XBa7;Sed pharetra, felis eget;Primis Corporation
qr+79_J7;erat. Sed nunc est, mollis non, cursus non, egestas;Nec Ante Associates
oH6MN62;sem mollis dui, in sodales elit;Pellentesque Foundation
sz+75_K7;Fusce mollis. Duis sit amet diam eu;Nec Ante Associates
u1AO3-N;Nunc lectus pede, ultrices;Sagittis Duis
oT1LE56;interdum. Curabitur dictum. Phasellus;Pellentesque Foundation
o5EI7-U;arcu;Sagittis Duis
SS-64DFh5;Nulla aliquet. Proin velit. Sed;Primis Corporation
iJ3CS34;faucibus. Morbi vehicula.;Pellentesque Foundation
QX-61FKo6;consectetuer adipiscing elit. Curabitur sed tortor. Integer aliquam adipiscing lacus.;Primis Corporation
o9EI8-Q;Sed auctor odio;Sagittis Duis
BE-54QNb1;tortor at risus.;Primis Corporation
iW8WY37;ornare,;Pellentesque Foundation
aq+81_U4;magna. Duis dignissim tempor arcu. Vestibulum ut eros;Nec Ante Associates
HX-55NCe7;sem semper erat, in consectetuer;Primis Corporation
OD-76MIf8;a, enim. Suspendisse;Primis Corporation
u2OE8-N;enim, sit;Sagittis Duis
xs+31_M5;nascetur ridiculus mus. Donec dignissim;Nec Ante Associates
e3EE4-Q;Fusce diam nunc, ullamcorper eu, euismod;Sagittis Duis
us+05_H6;ante. Vivamus non lorem vitae;Nec Ante Associates
JW-13SNr1;in lobortis tellus;Primis Corporation
u6EI7-F;sed turpis;Sagittis Duis
kf+16_A5;Curabitur egestas nunc sed libero.;Nec Ante Associates
GK-89NNm8;dolor sit amet, consectetuer adipiscing elit. Curabitur sed tortor.;Primis Corporation
i7EE8-W;magna. Cras convallis convallis dolor. Quisque tincidunt pede;Sagittis Duis
hr+84_H2;erat volutpat. Nulla dignissim. Maecenas ornare egestas;Nec Ante Associates
ap+58_C5;nunc sed libero. Proin;Nec Ante Associates
UB-63RLb1;amet, risus. Donec nibh enim, gravida sit;Primis Corporation
eU5NJ54;suscipit nonummy.;Pellentesque Foundation
eI0KX79;posuere, enim nisl elementum purus, accumsan;Pellentesque Foundation
oO9DZ32;pretium aliquet, metus urna convallis erat, eget tincidunt dui augue;Pellentesque Foundation
GJ-60YFo4;ridiculus mus. Aenean eget magna.;Primis Corporation
i4EU7-Y;nec luctus felis purus ac;Sagittis Duis
nf+22_F8;ac mi eleifend egestas. Sed;Nec Ante Associates
u5IO7-W;metus. Aenean sed pede nec ante blandit viverra.;Sagittis Duis
uJ2DW74;Aliquam vulputate ullamcorper magna. Sed;Pellentesque Foundation
vz+62_M8;augue, eu tempor erat neque non quam. Pellentesque habitant;Nec Ante Associates
DV-94GRt3;quis urna. Nunc quis arcu vel;Primis Corporation
iI6SH55;luctus lobortis. Class aptent taciti sociosqu ad litora torquent;Pellentesque Foundation
wo+47_J3;interdum. Sed;Nec Ante Associates
PX-58RAs8;ipsum leo elementum sem,;Primis Corporation
WG-51NKh4;est, vitae sodales nisi magna sed dui. Fusce aliquam,;Primis Corporation
aU7SG73;eget nisi dictum augue malesuada malesuada. Integer id magna et;Pellentesque Foundation
HG-99DEc4;mattis. Cras eget nisi dictum;Primis Corporation
i3EE9-S;a, aliquet vel,;Sagittis Duis
o2UO5-B;vitae odio sagittis semper. Nam tempor;Sagittis Duis
eG7LH75;pede. Nunc;Pellentesque Foundation
NJ-32HDn2;lectus. Nullam suscipit, est ac facilisis facilisis, magna;Primis Corporation
ek+35_L4;pharetra. Quisque ac libero nec ligula consectetuer rhoncus.;Nec Ante Associates
YU-27IQw2;justo eu arcu.;Primis Corporation
ef+87_V2;at risus. Nunc ac sem ut dolor;Nec Ante Associates
zr+35_M6;est tempor;Nec Ante Associates
QU-18YIq3;malesuada malesuada. Integer id magna et;Primis Corporation
dh+60_H3;In at pede. Cras vulputate;Nec Ante Associates
a7OE1-Y;a mi fringilla mi;Sagittis Duis
oF1KV27;justo. Proin;Pellentesque Foundation
i6OI5-Y;lorem ut aliquam iaculis, lacus pede sagittis augue, eu tempor;Sagittis Duis
e0EI5-H;ut mi. Duis risus odio, auctor vitae, aliquet nec,;Sagittis Duis
XH-17CJn3;Donec dignissim magna a tortor.;Primis Corporation
OY-64YNm2;commodo ipsum. Suspendisse non leo.;Primis Corporation
i4AO0-B;tincidunt orci quis lectus. Nullam suscipit, est ac;Sagittis Duis
