reference;libelle;marque
oU5QP44;odio. Aliquam vulputate ullamcorper;Pellentesque Foundation
QB-24JSl6;eu;Primis Corporation
i7IU0-C;vitae, posuere at, velit. Cras lorem;Sagittis Duis
CG-50LLu7;purus gravida sagittis. Duis gravida.;Primis Corporation
uI7UB44;magna a neque. Nullam;Pellentesque Foundation
iE6JF52;mi. Aliquam gravida mauris ut;Pellentesque Foundation
o8OO6-S;odio sagittis semper.;Sagittis Duis
UO-24HRh5;Vivamus molestie dapibus ligula. Aliquam erat;Primis Corporation
EC-59SEx7;at fringilla purus mauris a nunc. In at pede. Cras;Primis Corporation
DP-58PEw5;sem. Nulla interdum. Curabitur dictum. Phasellus;Primis Corporation
iH8TC63;sem egestas blandit. Nam nulla magna, malesuada vel,;Pellentesque Foundation
a8IA7-F;adipiscing elit. Aliquam auctor, velit;Sagittis Duis
i7AO8-C;nunc sed pede. Cum sociis;Sagittis Duis
i2EE4-T;quis lectus. Nullam suscipit, est;Sagittis Duis
i2IE8-V;dolor sit amet, consectetuer adipiscing elit. Etiam laoreet, libero;Sagittis Duis
ck+78_E3;eu eros. Nam consequat dolor;Nec Ante Associates
rg+88_J9;quam dignissim pharetra. Nam ac nulla.;Nec Ante Associates
eQ3HK14;facilisis vitae, orci. Phasellus dapibus quam quis diam.;Pellentesque Foundation
JF-73WBi9;sapien, gravida non, sollicitudin;Primis Corporation
PK-71WNi8;eu, euismod ac, fermentum vel, mauris. Integer;Primis Corporation
i3AE5-O;nec urna suscipit nonummy. Fusce;Sagittis Duis
o9EU7-R;vel turpis. Aliquam adipiscing lobortis;Sagittis Duis
NW-60RNj2;varius et, euismod et, commodo at, libero. Morbi;Primis Corporation
cy+37_G5;nec, eleifend non,;Nec Ante Associates
o8EO5-J;sed, est. Nunc laoreet lectus quis;Sagittis Duis
nq+56_I7;ut, pellentesque eget, dictum;Nec Ante Associates
iD7IE76;sapien imperdiet ornare. In faucibus. Morbi;Pellentesque Foundation
JK-43EAf9;odio, auctor vitae, aliquet nec, imperdiet;Primis Corporation
iO4XY89;lectus justo eu arcu. Morbi sit amet massa. Quisque porttitor;Pellentesque Foundation
oB3AP22;tortor, dictum eu, placerat eget, venenatis a, magna.;Pellentesque Foundation
CI-47CSj4;tellus;Primis Corporation
i0EE7-F;ipsum non arcu. Vivamus sit amet;Sagittis Duis
oS1CL37;vitae semper egestas, urna justo faucibus lectus, a;Pellentesque Foundation
i1AE7-S;mattis semper, dui lectus rutrum urna, nec luctus felis;Sagittis Duis
mp+64_J2;sapien. Aenean massa. Integer vitae nibh.;Nec Ante Associates
i2EE6-Q;Phasellus vitae;Sagittis Duis
e7EO1-Z;dignissim. Maecenas ornare egestas ligula. Nullam feugiat placerat velit.;Sagittis Duis
WG-65OVv7;in sodales elit;Primis Corporation
iT7GC85;tempor arcu. Vestibulum ut eros non enim commodo hendrerit.;Pellentesque Foundation
OS-02RVv2;Quisque ornare tortor at;Primis Corporation
PK-58EMe7;feugiat. Lorem ipsum dolor sit amet, consectetuer;Primis Corporation
e5OE6-T;non, vestibulum;Sagittis Duis
iK1VS27;placerat, orci lacus vestibulum lorem,;Pellentesque Foundation
om+57_X2;euismod urna. Nullam lobortis quam a;Nec Ante Associates
oD2NB61;vel arcu eu odio tristique pharetra.;Pellentesque Foundation
GG-82XXq5;est ac mattis semper,;Primis Corporation
oV1GL76;nibh sit amet orci. Ut sagittis lobortis mauris. Suspendisse;Pellentesque Foundation
CB-24TJv2;Donec tempus, lorem fringilla ornare placerat, orci;Primis Corporation
DO-17DBf8;et ultrices posuere cubilia Curae Phasellus ornare. Fusce;Primis Corporation
i2EO0-X;vel;Sagittis Duis
ne+61_D3;sociis natoque penatibus et;Nec Ante Associates
KT-83QXe7;velit justo nec ante. Maecenas;Primis Corporation
pj+11_D1;justo nec ante. Maecenas mi felis, adipiscing fringilla, porttitor;Nec Ante Associates
eY3SO93;amet metus.;Pellentesque Foundation
ym+65_X2;mauris, aliquam eu, accumsan sed,;Nec Ante Associates
oX4PJ47;nascetur ridiculus mus. Aenean eget magna. Suspendisse tristique neque venenatis;Pellentesque Foundation
zp+24_O2;elit, pellentesque a, facilisis non,;Nec Ante Associates
OH-25QPs7;velit eget laoreet posuere, enim nisl elementum;Primis Corporation
u0IU4-X;tellus. Phasellus elit pede, malesuada vel,;Sagittis Duis
MU-73VYh4;urna. Nunc quis arcu vel;Primis Corporation
iQ5NZ77;enim nec tempus scelerisque, lorem ipsum sodales purus,;Pellentesque Foundation
eN7SE76;elementum at, egestas a, scelerisque sed, sapien. Nunc;Pellentesque Foundation
o4IE9-T;Mauris vel turpis. Aliquam adipiscing lobortis risus. In mi pede,;Sagittis Duis
oH2FJ23;nisi magna sed dui. Fusce aliquam, enim nec tempus;Pellentesque Foundation
wu+19_B6;urna convallis;Nec Ante Associates
i3IO6-Q;Quisque fringilla euismod enim. Etiam gravida molestie arcu. Sed;Sagittis Duis
NG-82ZNi7;Sed eget lacus. Mauris non;Primis Corporation
NM-76MJf2;quis urna. Nunc quis arcu vel quam;Primis Corporation
oN7XI73;ut, nulla. Cras eu tellus;Pellentesque Foundation
zv+22_F4;Nulla aliquet. Proin velit.;Nec Ante Associates
u7AI5-V;auctor. Mauris;Sagittis Duis
oA5CN43;placerat.;Pellentesque Foundation
oX5NQ52;mi tempor lorem,;Pellentesque Foundation
tw+53_R1;rutrum, justo.;Nec Ante Associates
XF-02JKz1;Donec feugiat metus sit amet;Primis Corporation
uR3HZ85;amet, faucibus ut, nulla. Cras eu;Pellentesque Foundation
VU-53HLt1;Phasellus vitae mauris sit;Primis Corporation
eP2XE47;malesuada vel, convallis in, cursus;Pellentesque Foundation
i3II3-N;Integer id magna et;Sagittis Duis
a8II6-U;Pellentesque ut ipsum ac mi eleifend egestas. Sed pharetra, felis;Sagittis Duis
e2II6-T;cursus. Integer mollis. Integer tincidunt aliquam arcu. Aliquam;Sagittis Duis
OS-57ALi2;Nunc commodo auctor velit. Aliquam nisl. Nulla eu;Primis Corporation
i5AE9-I;tempus risus. Donec;Sagittis Duis
e1OU5-B;nibh. Quisque;Sagittis Duis
a9AO3-M;gravida sit amet, dapibus;Sagittis Duis
oD1CP32;vitae odio sagittis semper. Nam tempor diam dictum;Pellentesque Foundation
wc+32_I1;sit amet, faucibus ut, nulla. Cras eu tellus eu;Nec Ante Associates
u7EE4-O;tincidunt adipiscing. Mauris;Sagittis Duis
fj+21_L4;habitant morbi;Nec Ante Associates
i6EO8-U;malesuada fringilla est. Mauris;Sagittis Duis
UL-11OOk4;penatibus et magnis dis parturient montes, nascetur ridiculus;Primis Corporation
PB-01YRc5;cursus luctus, ipsum leo elementum sem, vitae aliquam;Primis Corporation
TN-92APm6;parturient;Primis Corporation
KV-32QUz3;nisi a odio semper cursus. Integer mollis. Integer;Primis Corporation
aE0DP45;sagittis augue,;Pellentesque Foundation
do+83_U5;mauris. Morbi non sapien;Nec Ante Associates
qf+21_E7;metus. In nec orci. Donec nibh. Quisque nonummy;Nec Ante Associates
HJ-57UVg4;conubia nostra, per inceptos hymenaeos. Mauris ut;Primis Corporation
aQ4CI44;nascetur ridiculus mus. Proin vel nisl.;Pellentesque Foundation
sh+59_V1;Donec sollicitudin adipiscing ligula. Aenean gravida nunc sed;Nec Ante Associates
e1II9-W;sodales at, velit. Pellentesque;Sagittis Duis
iP9BH19;cursus a, enim. Suspendisse aliquet, sem ut cursus luctus,;Pellentesque Foundation
FM-66SXu5;dis parturient;Primis Corporation
e1IA4-X;Vivamus nisi. Mauris nulla. Integer;Sagittis Duis
dj+93_K3;ad litora torquent per conubia;Nec Ante Associates
aG2PI12;at, nisi. Cum sociis natoque penatibus;Pellentesque Foundation
NU-59TBm5;sem. Pellentesque ut;Primis Corporation
LT-25RYq4;a nunc. In;Primis Corporation
DJ-67UDf2;in felis. Nulla tempor;Primis Corporation
e2EE8-Y;pellentesque a,;Sagittis Duis
iG3NS35;rutrum eu, ultrices sit;Pellentesque Foundation
SO-64DNb8;Duis;Primis Corporation
BK-83GYc3;Curabitur vel lectus. Cum sociis natoque;Primis Corporation
RV-19UAa2;Vivamus non lorem;Primis Corporation
il+66_I4;mauris eu elit. Nulla facilisi. Sed neque. Sed;Nec Ante Associates
XG-19MDb8;aliquet, metus urna convallis erat, eget tincidunt dui;Primis Corporation
iS7UJ31;eros. Nam consequat dolor vitae dolor. Donec fringilla. Donec feugiat;Pellentesque Foundation
DM-57GNg4;lobortis ultrices.;Primis Corporation
xh+16_Y2;pede,;Nec Ante Associates
UK-68WLj7;ac mattis ornare, lectus ante;Primis Corporation
e6OI0-Q;ligula. Nullam enim. Sed nulla ante, iaculis nec,;Sagittis Duis
DB-52OSw9;Aenean egestas hendrerit neque. In ornare sagittis;Primis Corporation
aM3IL22;vitae sodales nisi magna sed dui. Fusce aliquam,;Pellentesque Foundation
TW-43GUr3;Etiam gravida molestie arcu. Sed eu;Primis Corporation
eE4SC66;vel est tempor bibendum. Donec;Pellentesque Foundation
oC7WE12;magna tellus faucibus leo, in lobortis;Pellentesque Foundation
oO8DD34;sem ut dolor dapibus gravida. Aliquam tincidunt,;Pellentesque Foundation
vv+09_H9;Phasellus in felis. Nulla tempor augue ac ipsum. Phasellus;Nec Ante Associates
e7EA2-D;tempor, est ac mattis semper,;Sagittis Duis
GD-76MXz3;risus, at;Primis Corporation
NZ-14CIz7;ultricies adipiscing, enim mi tempor lorem, eget mollis;Primis Corporation
HL-56OTe3;lobortis. Class aptent taciti sociosqu ad litora torquent;Primis Corporation
zf+82_K3;dictum. Proin eget odio. Aliquam vulputate ullamcorper;Nec Ante Associates
PV-12RYo5;libero. Donec consectetuer mauris id sapien.;Primis Corporation
e2OI6-Z;velit. Sed malesuada augue ut;Sagittis Duis
xi+46_M3;fames ac turpis egestas. Aliquam;Nec Ante Associates
sl+78_M1;accumsan neque et nunc. Quisque ornare tortor at;Nec Ante Associates
yc+73_C5;non, egestas a, dui. Cras pellentesque. Sed dictum. Proin;Nec Ante Associates
PY-26KUx1;urna justo faucibus lectus, a sollicitudin orci;Primis Corporation
sg+77_Z7;sed sem egestas blandit. Nam;Nec Ante Associates
PG-28VAd4;senectus et netus et malesuada fames ac turpis;Primis Corporation
QT-36LOc8;nunc sit amet;Primis Corporation
JD-53BFv6;enim. Etiam;Primis Corporation
oE5KF78;bibendum fermentum metus. Aenean;Pellentesque Foundation
i7AI6-O;justo nec ante. Maecenas mi felis, adipiscing fringilla,;Sagittis Duis
aK2FH63;nulla. Integer urna. Vivamus molestie dapibus ligula. Aliquam erat;Pellentesque Foundation
sq+85_N8;mauris elit, dictum;Nec Ante Associates
uV9MF76;erat,;Pellentesque Foundation
aY1DC87;Duis cursus, diam at pretium aliquet,;Pellentesque Foundation
e8EE5-A;tellus sem mollis dui, in;Sagittis Duis
MD-33UOb6;elit, pharetra;Primis Corporation
uL5RO42;ligula. Aenean gravida nunc;Pellentesque Foundation
td+81_V4;dui nec urna suscipit nonummy. Fusce fermentum;Nec Ante Associates
lp+73_I6;arcu et pede. Nunc sed orci;Nec Ante Associates
a6IO1-P;lorem ac risus. Morbi metus. Vivamus;Sagittis Duis
nq+64_S2;lobortis mauris. Suspendisse aliquet molestie tellus. Aenean egestas hendrerit;Nec Ante Associates
BH-87QHs7;ipsum ac mi eleifend;Primis Corporation
CT-22BMi3;odio sagittis semper. Nam tempor;Primis Corporation
o6EE7-Y;enim. Etiam gravida molestie arcu. Sed eu nibh vulputate mauris;Sagittis Duis
oY1WV39;ac turpis egestas. Aliquam fringilla cursus purus. Nullam scelerisque neque;Pellentesque Foundation
JB-38MWp5;Integer tincidunt aliquam arcu. Aliquam ultrices;Primis Corporation
jv+64_J3;scelerisque sed, sapien. Nunc pulvinar arcu et pede. Nunc sed;Nec Ante Associates
i2OU8-D;ipsum dolor sit amet, consectetuer adipiscing elit. Curabitur;Sagittis Duis
i1IO9-J;feugiat metus sit amet ante. Vivamus non lorem;Sagittis Duis
kf+19_F2;faucibus ut, nulla.;Nec Ante Associates
MY-72PDk8;ac tellus. Suspendisse sed dolor. Fusce mi lorem, vehicula et,;Primis Corporation
a6OE4-P;nulla. Integer vulputate, risus a ultricies adipiscing, enim mi;Sagittis Duis
u3OI8-X;ut quam vel sapien imperdiet ornare. In;Sagittis Duis
a9OO4-F;Duis ac arcu. Nunc mauris. Morbi non;Sagittis Duis
WG-96ESk6;nonummy ut, molestie in, tempus eu, ligula.;Primis Corporation
fj+03_X8;Nulla eget metus eu erat semper rutrum.;Nec Ante Associates
KH-76KPs7;viverra. Donec tempus, lorem;Primis Corporation
HJ-70PTt3;libero. Donec consectetuer;Primis Corporation
iC0FU38;in consequat enim diam vel arcu.;Pellentesque Foundation
wz+25_B2;sem. Pellentesque;Nec Ante Associates
WH-16WWm6;cursus. Nunc mauris elit,;Primis Corporation
VJ-33KOr8;Nam ac nulla. In tincidunt congue turpis. In;Primis Corporation
NO-84IEy7;risus varius orci, in consequat enim diam vel arcu. Curabitur;Primis Corporation
it+73_I8;torquent per conubia nostra, per inceptos;Nec Ante Associates
e2OA4-A;orci quis lectus. Nullam suscipit, est;Sagittis Duis
eI1YQ55;mi. Aliquam gravida mauris;Pellentesque Foundation
XC-37PIm5;vehicula risus. Nulla eget metus;Primis Corporation
YV-83LMt6;tincidunt congue turpis. In condimentum.;Primis Corporation
a7II9-X;ultricies adipiscing, enim mi tempor lorem, eget;Sagittis Duis
oC2CX85;facilisis, magna;Pellentesque Foundation
SK-12SSb2;ut, nulla. Cras eu tellus eu;Primis Corporation
i3AE1-Z;ut erat.;Sagittis Duis
qn+56_W1;vitae risus. Duis a mi fringilla mi;Nec Ante Associates
i0II0-J;sed;Sagittis Duis
AL-51GUb2;Nullam vitae diam. Proin dolor. Nulla;Primis Corporation
KO-14CRy3;enim commodo hendrerit. Donec;Primis Corporation
i8AA6-T;Mauris ut quam vel sapien imperdiet ornare. In faucibus.;Sagittis Duis
ou+12_G2;lacinia mattis. Integer eu lacus. Quisque imperdiet,;Nec Ante Associates
KF-68CXh7;lacus. Ut nec;Primis Corporation
FX-35EFm7;consequat, lectus sit amet luctus vulputate,;Primis Corporation
ko+68_U4;nunc, ullamcorper eu,;Nec Ante Associates
HH-14VTd7;eu metus. In lorem. Donec elementum, lorem ut;Primis Corporation
o4OI1-N;Integer;Sagittis Duis
oY9SC58;fames ac turpis egestas. Aliquam fringilla cursus purus. Nullam;Pellentesque Foundation
aN2RC97;viverra. Donec tempus, lorem fringilla ornare placerat, orci lacus;Pellentesque Foundation
ZE-16CRv7;egestas. Fusce;Primis Corporation
oU2MP23;penatibus et;Pellentesque Foundation
e8IE8-R;risus a ultricies adipiscing, enim mi;Sagittis Duis
ue+36_Q8;Etiam gravida molestie arcu. Sed eu nibh;Nec Ante Associates
eG1VC18;eget mollis lectus pede et risus.;Pellentesque Foundation
iS4OK35;dui, semper et, lacinia vitae, sodales at, velit.;Pellentesque Foundation
TC-15LEj5;scelerisque neque sed;Primis Corporation
SD-69JZd2;purus. Maecenas libero est, congue a, aliquet vel,;Primis Corporation
YB-57PFs7;Mauris quis turpis vitae purus gravida sagittis. Duis;Primis Corporation
i5AE6-Y;ultrices sit amet,;Sagittis Duis
DF-63LSx7;metus;Primis Corporation
iH2OG74;interdum. Sed auctor odio a;Pellentesque Foundation
ah+35_M5;Vivamus sit amet risus. Donec;Nec Ante Associates
TF-61WHc7;egestas;Primis Corporation
BM-77IYu2;montes, nascetur ridiculus mus. Proin;Primis Corporation
u5IE8-L;quam;Sagittis Duis
XB-14HKj6;Nam nulla;Primis Corporation
eN3JG54;viverra. Donec tempus, lorem fringilla ornare placerat, orci;Pellentesque Foundation
el+29_V5;conubia nostra, per inceptos hymenaeos. Mauris ut quam vel;Nec Ante Associates
XQ-20SSo7;inceptos hymenaeos. Mauris ut quam vel sapien;Primis Corporation
e2UU9-P;Morbi quis urna. Nunc quis arcu vel quam dignissim;Sagittis Duis
i7UE4-X;ante blandit viverra. Donec tempus, lorem fringilla;Sagittis Duis
iO8TM69;convallis ligula. Donec luctus aliquet odio.;Pellentesque Foundation
BK-74EJt1;erat vitae risus.;Primis Corporation
EB-67GBo3;et, commodo at, libero. Morbi accumsan laoreet ipsum. Curabitur;Primis Corporation
sw+27_Z3;ultricies adipiscing, enim mi tempor lorem,;Nec Ante Associates
oN4NI42;eu nibh vulputate mauris sagittis placerat.;Pellentesque Foundation
VI-13MKm8;purus sapien, gravida;Primis Corporation
aT7XV83;volutpat. Nulla dignissim. Maecenas ornare egestas ligula. Nullam feugiat;Pellentesque Foundation
u4EO6-L;pellentesque massa lobortis ultrices. Vivamus rhoncus. Donec est.;Sagittis Duis
u4AE5-H;Phasellus nulla. Integer vulputate, risus a ultricies adipiscing, enim;Sagittis Duis
YE-65VSr7;vulputate ullamcorper magna. Sed eu eros. Nam consequat dolor vitae;Primis Corporation
KW-77BDf7;ante. Maecenas;Primis Corporation
e3IO0-D;felis.;Sagittis Duis
mb+77_N4;Mauris eu turpis. Nulla;Nec Ante Associates
WB-96AQe2;malesuada vel, venenatis vel, faucibus id, libero. Donec consectetuer mauris;Primis Corporation
o4II8-W;ligula. Donec luctus aliquet odio. Etiam ligula tortor, dictum;Sagittis Duis
oB5RT65;eu elit. Nulla facilisi. Sed;Pellentesque Foundation
gf+44_F5;ipsum primis in faucibus orci luctus et ultrices;Nec Ante Associates
BB-71IZp3;erat. Sed nunc est, mollis non, cursus non, egestas a,;Primis Corporation
GH-34HAg2;neque;Primis Corporation
u6OO4-E;lacus. Aliquam rutrum;Sagittis Duis
lk+17_C6;non, vestibulum nec, euismod in, dolor. Fusce feugiat. Lorem;Nec Ante Associates
WX-13EUb4;urna. Nunc quis arcu vel quam dignissim;Primis Corporation
o4OA4-I;nisi a odio semper cursus. Integer mollis. Integer tincidunt;Sagittis Duis
eY4WB23;Cras sed leo.;Pellentesque Foundation
e1II4-T;mi eleifend egestas. Sed pharetra,;Sagittis Duis
dr+44_A4;mi lorem, vehicula et, rutrum eu, ultrices;Nec Ante Associates
ye+24_C3;elit sed consequat auctor, nunc nulla vulputate dui, nec;Nec Ante Associates
uF8CL74;Vivamus;Pellentesque Foundation
KI-89XVv8;sagittis augue, eu tempor erat;Primis Corporation
iB1ND33;non, dapibus rutrum, justo. Praesent luctus. Curabitur egestas nunc;Pellentesque Foundation
iQ5YC33;fringilla purus mauris a nunc. In at pede. Cras vulputate;Pellentesque Foundation
co+33_U1;enim. Nunc ut erat.;Nec Ante Associates
WJ-80QRy9;Phasellus nulla.;Primis Corporation
ed+74_Z3;non enim;Nec Ante Associates
eT6NZ33;lorem eu metus.;Pellentesque Foundation
a1UI9-D;congue, elit sed consequat;Sagittis Duis
eB2XS24;luctus vulputate,;Pellentesque Foundation
eH1CY16;lectus. Cum sociis natoque penatibus et magnis dis parturient;Pellentesque Foundation
wb+29_F9;scelerisque;Nec Ante Associates
QC-14VVw6;Quisque varius. Nam porttitor scelerisque neque. Nullam nisl. Maecenas;Primis Corporation
iQ7QH31;inceptos hymenaeos.;Pellentesque Foundation
FE-07STo8;laoreet,;Primis Corporation
e8EE5-C;dui lectus rutrum urna, nec luctus felis;Sagittis Duis
o8AU4-T;scelerisque neque. Nullam nisl. Maecenas malesuada fringilla est. Mauris;Sagittis Duis
o3AI5-L;eget tincidunt dui augue eu;Sagittis Duis
aU1RT26;rutrum urna, nec luctus felis purus ac tellus.;Pellentesque Foundation
e8OE4-F;mollis. Phasellus libero mauris, aliquam;Sagittis Duis
o6OA4-O;pede, ultrices a, auctor non, feugiat nec, diam.;Sagittis Duis
UM-83QIn8;dui. Cras pellentesque. Sed dictum. Proin eget odio. Aliquam vulputate;Primis Corporation
eS4EY93;Nulla eu neque pellentesque massa lobortis ultrices. Vivamus;Pellentesque Foundation
dt+82_D3;non massa non ante bibendum;Nec Ante Associates
NN-38SVv2;tellus. Nunc;Primis Corporation
MO-73RXt9;quam. Pellentesque habitant;Primis Corporation
ok+61_G3;feugiat. Lorem ipsum;Nec Ante Associates
AD-74YMb4;vitae, erat. Vivamus nisi. Mauris nulla. Integer;Primis Corporation
QC-07POu7;pretium et, rutrum non, hendrerit id, ante. Nunc mauris;Primis Corporation
CL-48IFb6;amet luctus;Primis Corporation
PP-66TNl4;Donec luctus aliquet odio. Etiam ligula tortor, dictum;Primis Corporation
iU2YY28;Donec felis orci,;Pellentesque Foundation
sy+33_L6;tellus. Nunc;Nec Ante Associates
e4OU2-E;amet, consectetuer;Sagittis Duis
VJ-11JWi8;lobortis augue scelerisque mollis. Phasellus libero;Primis Corporation
ON-52OZs8;amet, consectetuer adipiscing;Primis Corporation
ai+63_M1;sagittis. Duis gravida. Praesent eu nulla;Nec Ante Associates
uA5PF63;nec, euismod in, dolor. Fusce feugiat. Lorem ipsum;Pellentesque Foundation
a6IU2-S;a felis ullamcorper viverra.;Sagittis Duis
JJ-15SLj3;pellentesque. Sed dictum. Proin eget odio. Aliquam vulputate ullamcorper magna.;Primis Corporation
bi+35_T9;et ipsum cursus;Nec Ante Associates
oX0MQ79;Proin;Pellentesque Foundation
iT3HS43;placerat, orci;Pellentesque Foundation
GD-21HMg8;non justo. Proin non massa non;Primis Corporation
jm+88_C3;odio, auctor vitae, aliquet nec,;Nec Ante Associates
i5II5-L;Phasellus elit pede, malesuada vel,;Sagittis Duis
go+29_G4;Aliquam rutrum;Nec Ante Associates
iR3GU13;elit, pharetra ut, pharetra sed, hendrerit;Pellentesque Foundation
uG6NQ44;dui augue eu tellus. Phasellus elit pede,;Pellentesque Foundation
UJ-31WQp5;nisl. Nulla;Primis Corporation
su+64_I9;enim.;Nec Ante Associates
i5UI4-R;dui;Sagittis Duis
oR4OC15;ante. Nunc mauris sapien, cursus;Pellentesque Foundation
i5AI5-T;magna a tortor. Nunc;Sagittis Duis
o5EI7-V;semper rutrum. Fusce dolor quam, elementum at,;Sagittis Duis
FN-34BWm4;at, velit. Pellentesque ultricies dignissim lacus.;Primis Corporation
jh+91_J4;lacus vestibulum lorem, sit;Nec Ante Associates
i3AA1-X;magna. Praesent interdum ligula eu enim.;Sagittis Duis
LV-23WOx5;Vestibulum ut eros non enim commodo hendrerit.;Primis Corporation
oJ4PK31;sem ut;Pellentesque Foundation
WF-51BCn4;dolor dolor, tempus non, lacinia at, iaculis quis, pede.;Primis Corporation
uh+26_L7;gravida. Praesent eu nulla at sem molestie sodales.;Nec Ante Associates
uH5SG67;egestas. Aliquam nec enim. Nunc ut;Pellentesque Foundation
uO4OR62;Duis cursus, diam at;Pellentesque Foundation
DJ-54YIc4;sit amet, dapibus;Primis Corporation
o5OU8-Q;ac urna. Ut tincidunt;Sagittis Duis
a7OI8-T;felis. Nulla tempor augue ac;Sagittis Duis
oZ4NN32;Donec fringilla. Donec feugiat metus sit amet ante. Vivamus non;Pellentesque Foundation
iJ3SS57;sagittis. Nullam vitae diam. Proin dolor. Nulla;Pellentesque Foundation
TU-24ZKd1;Donec luctus aliquet odio. Etiam ligula tortor, dictum eu,;Primis Corporation
YJ-87RNn8;at augue id ante;Primis Corporation
aV6LI82;fermentum vel, mauris.;Pellentesque Foundation
o1EE3-W;urna convallis erat, eget tincidunt dui augue;Sagittis Duis
o8EE8-M;erat vel pede blandit congue.;Sagittis Duis
NL-52RVc9;ipsum;Primis Corporation
DE-13MTg8;Fusce aliquam, enim;Primis Corporation
a6EI3-J;Nunc mauris. Morbi;Sagittis Duis
oO7EW54;et ipsum cursus vestibulum. Mauris magna.;Pellentesque Foundation
JK-42NCy2;non, bibendum sed, est. Nunc laoreet lectus;Primis Corporation
AJ-18EYe8;imperdiet ornare. In;Primis Corporation
uk+38_G6;mauris sapien, cursus in, hendrerit;Nec Ante Associates
oC2WQ22;augue. Sed molestie. Sed id risus quis;Pellentesque Foundation
IV-85DFx2;eget metus eu;Primis Corporation
RL-37CEn6;dolor dapibus gravida. Aliquam tincidunt, nunc ac;Primis Corporation
ca+67_A3;lorem. Donec elementum, lorem ut aliquam;Nec Ante Associates
eI9OI72;consequat, lectus sit amet luctus vulputate, nisi sem;Pellentesque Foundation
eZ3HH51;volutpat. Nulla;Pellentesque Foundation
i8EE2-U;torquent per conubia nostra, per inceptos;Sagittis Duis
cp+30_T5;condimentum. Donec at arcu.;Nec Ante Associates
o3OU7-U;montes, nascetur ridiculus;Sagittis Duis
eu+45_I8;eu dui. Cum sociis natoque penatibus et magnis dis parturient;Nec Ante Associates
iH9OQ28;risus odio, auctor vitae,;Pellentesque Foundation
yu+23_T2;vestibulum nec, euismod in, dolor. Fusce feugiat.;Nec Ante Associates
XZ-13GEp4;a sollicitudin orci;Primis Corporation
u0AO5-M;et magnis dis parturient montes, nascetur ridiculus;Sagittis Duis
iR6DP45;non, feugiat nec, diam. Duis mi enim, condimentum eget,;Pellentesque Foundation
eu+27_C4;non justo. Proin non massa non;Nec Ante Associates
i4EI3-R;Cras eu tellus eu augue;Sagittis Duis
FV-75WWd8;lorem, auctor quis, tristique;Primis Corporation
bu+71_I9;semper egestas, urna justo faucibus;Nec Ante Associates
i8OI5-G;natoque penatibus et magnis dis parturient montes, nascetur ridiculus;Sagittis Duis
i3EU0-L;rhoncus id,;Sagittis Duis
eQ1TH66;Morbi non sapien molestie;Pellentesque Foundation
aS9BP96;gravida molestie arcu.;Pellentesque Foundation
MS-64TEt7;aliquet molestie tellus. Aenean egestas hendrerit;Primis Corporation
a3EA7-A;orci, in consequat enim diam vel arcu. Curabitur;Sagittis Duis
LH-85KAy2;nec luctus;Primis Corporation
u2EO7-F;luctus aliquet odio. Etiam ligula tortor, dictum eu, placerat;Sagittis Duis
VL-60MKj3;pede sagittis augue, eu tempor erat neque non quam.;Primis Corporation
o3IO3-D;tincidunt dui augue eu tellus. Phasellus;Sagittis Duis
fh+59_Y9;lobortis ultrices. Vivamus rhoncus. Donec est. Nunc ullamcorper,;Nec Ante Associates
WE-38YTq8;neque.;Primis Corporation
e7IE8-I;ante dictum cursus. Nunc mauris elit, dictum eu, eleifend nec,;Sagittis Duis
mo+34_P6;Suspendisse sagittis. Nullam vitae diam. Proin dolor.;Nec Ante Associates
CK-41SYe6;sem. Pellentesque ut;Primis Corporation
KF-93TXr7;lorem. Donec elementum,;Primis Corporation
WM-74UBl2;mollis vitae, posuere at, velit.;Primis Corporation
ys+84_D2;semper;Nec Ante Associates
UJ-96KZi3;Proin;Primis Corporation
e8EU4-F;magna sed dui. Fusce aliquam, enim nec;Sagittis Duis
LJ-69QQj2;Phasellus dolor elit, pellentesque a, facilisis;Primis Corporation
GB-64MAn5;amet,;Primis Corporation
CE-68KZj4;dictum. Phasellus in felis. Nulla tempor augue ac ipsum.;Primis Corporation
a8UI1-J;egestas hendrerit neque. In ornare sagittis;Sagittis Duis
iL1LH28;vehicula;Pellentesque Foundation
i8OU3-L;ipsum. Phasellus vitae mauris sit amet lorem semper;Sagittis Duis
e4IU7-O;eget tincidunt dui augue;Sagittis Duis
uL2OB35;ipsum primis;Pellentesque Foundation
oI1YW48;tempus non, lacinia at, iaculis quis, pede.;Pellentesque Foundation
aO2NZ86;id ante dictum cursus. Nunc mauris elit, dictum;Pellentesque Foundation
NH-10MIc7;porttitor vulputate, posuere vulputate, lacus.;Primis Corporation
u2II0-W;Cras vulputate;Sagittis Duis
aL1EI35;purus;Pellentesque Foundation
VW-25RIb6;Nulla tempor augue;Primis Corporation
bm+25_D3;pellentesque a, facilisis non, bibendum sed, est.;Nec Ante Associates
o5EA7-H;viverra. Maecenas iaculis aliquet diam. Sed diam;Sagittis Duis
i0OA4-N;fermentum vel, mauris. Integer sem elit, pharetra;Sagittis Duis
JM-62TUg8;In condimentum. Donec at arcu. Vestibulum ante ipsum;Primis Corporation
uw+54_D8;aliquam adipiscing lacus. Ut;Nec Ante Associates
XY-17XGx8;lacus. Quisque purus sapien, gravida non,;Primis Corporation
u8OI1-J;lobortis. Class aptent taciti sociosqu ad;Sagittis Duis
be+16_M2;magna, malesuada vel, convallis in, cursus et, eros. Proin ultrices.;Nec Ante Associates
u2OA2-H;tellus eu augue;Sagittis Duis
o4EO3-V;a mi fringilla mi lacinia mattis. Integer eu;Sagittis Duis
u2IU9-L;eget metus eu erat;Sagittis Duis
aI8JT44;enim. Etiam imperdiet dictum magna. Ut;Pellentesque Foundation
ru+81_K2;Mauris quis turpis vitae purus;Nec Ante Associates
HU-51KMu6;ac orci. Ut semper pretium neque. Morbi;Primis Corporation
PO-21PFd6;lorem semper auctor. Mauris vel;Primis Corporation
e5IU1-M;ligula. Nullam enim. Sed nulla ante, iaculis nec, eleifend;Sagittis Duis
iA2YB62;et tristique pellentesque, tellus sem mollis dui,;Pellentesque Foundation
wd+22_C6;lorem.;Nec Ante Associates
iO6GN37;in molestie tortor;Pellentesque Foundation
